{
  "classification": {
    "matched_terms": {
      "comfort-vs-decision": [
        "decision"
      ]
    },
    "method": "ctr-keywords-v1",
    "requires_review": true
  },
  "context_hash": "sha256:8c4730fb05ecddd868e836c4102cfa65d46a98ae290b1078d2e90c68f913b386",
  "decay": {
    "compost_target": "compost/issues/issue-1-1366e290f36ca6652f7d7c8850a8a01f3b9e833351bee49773a0eef351826468.json",
    "policy": "review_before_compost",
    "review_after": "2026-09-29T14:17:32+00:00",
    "ttl_days": 90
  },
  "event_id": "event:hiroshitanaka-creator/consciousness-tensor-repository:issue-1",
  "initial_status": "unassimilated",
  "possible_wounds": [
    "observation-vs-task",
    "comfort-vs-decision"
  ],
  "raw_issue": "#1 Issue: ExperienceEvent ingestion\u3092\u5b9f\u88c5\u3059\u308b",
  "revision_id": "sha256:1366e290f36ca6652f7d7c8850a8a01f3b9e833351bee49773a0eef351826468",
  "source": {
    "action": "snapshot",
    "body": "Issue: ExperienceEvent ingestion\u3092\u5b9f\u88c5\u3059\u308b\n\n\u76ee\u7684:\nGitHub Issue\u3092\u5358\u306a\u308b\u30bf\u30b9\u30af\u3067\u306f\u306a\u304f\u3001wounds/unresolved/ \u306b\u767b\u9332\u3055\u308c\u308b ExperienceEvent \u3068\u3057\u3066\u51e6\u7406\u3059\u308b\u3002\n\n\u5fc5\u8981:\n- kernel/experience_event.py\n- schemas/experience_event.schema.json\n- .github/workflows/issue_ingest.yml\n- contradiction_matrix.json \u66f4\u65b0\n- decision_rite \u66f4\u65b0",
    "created_at": "2026-07-01T14:17:32+00:00",
    "number": 1,
    "repository": "hiroshitanaka-creator/consciousness-tensor-repository",
    "state": "open",
    "title": "Issue: ExperienceEvent ingestion\u3092\u5b9f\u88c5\u3059\u308b",
    "updated_at": "2026-07-01T14:17:32+00:00",
    "url": "https://github.com/hiroshitanaka-creator/consciousness-tensor-repository/issues/1"
  },
  "surface_request": "Issue: ExperienceEvent ingestion\u3092\u5b9f\u88c5\u3059\u308b"
}
